link,ticker,title
https://www.blog.google/technology/quantum/quantum-supremacy/,GOOGL,Google announces breakthrough in quantum computing
https://www.reuters.com/technology/apple-hit-new-app-store-lawsuit-2023-06-12/,AAPL,Apple faces new lawsuit over App Store policies
https://www.reuters.com/business/autos-transportation/tesla-recalls-vehicles-over-software-issue-2023-01-27/,TSLA,"Tesla recalls over 500,000 vehicles due to software issue"
https://www.wsj.com/articles/amazon-acquires-robotics-firm-11658482861,AMZN,Amazon to acquire major robotics firm
https://www.cnbc.com/2021/03/31/microsoft-wins-contract-to-supply-us-army-ar-headsets.html,MSFT,Microsoft wins massive $22 billion US Army contract
https://www.cnbc.com/2021/07/20/netflix-nflx-earnings-q2-2021.html,NFLX,"Netflix reports subscriber growth slowdown, shares tumble"
